{
  "schemaVersion": "1.0.0",
  "eventTimestampUTC": "2025-10-16T03:15:48Z",
  "source": {
    "agent": "Lloyd Alexander",
    "sessionId": "cmgla400d0000rz78qnq1660j",
    "project": "floai.studio"
  },
  "content": {
    "type": "session_summary",
    "title": "Eternal Zord Fix & Documentation Branding Cleanup",
    "summary": "Successfully diagnosed and resolved Eternal Zord startup issues, and completed comprehensive branding updates across external-facing documentation and the project roadmap.",
    "details": "The session focused on troubleshooting and fixing Eternal Zord's persistent 404 errors, which was identified as a Python relative import problem. After resolution, all external-facing documentation (including `CONTEXT_ENTRY.md`, `roadmap.md`, and blog posts) was meticulously updated to reflect `floai.studio` branding. State files were synchronized, and Eternal Zord reanchored.",
    "tags": ["Eternal Zord", "Debugging", "FastAPI", "Python", "Branding", "Documentation", "Roadmap", "floai.studio"],
    "metrics": {
      "completion_percentage": 99.5,
      "files_modified": 10,
      "features_implemented": 2
    }
  }
}
